{
  "name": "Example Title",
  "partition": "example_value",
  "description": "A sample description.",
  "loadBalancingMode": "example_value",
  "monitor": "example_value",
  "members": [],
  "serviceDownAction": "example_value",
  "slowRampTime": 10,
  "allowNat": "example_value",
  "allowSnat": "example_value"
}